{"assurance":"aggregate_hidden_infrastructure_evidence_only_not_phase0_exit_evidence","evaluation_status":"non_evaluable_no_burden_compliant_comparator","gate_report":{"assurance":"comparative_metrics_only","benchmark_report_digest":"sha256:61b2dff4d8c97418ad1be9a6f43527f02fe456f6717782817a81ede80436f9bd","candidate_policy_digest":"sha256:817bc01e97437c2d5a38971c5164dae28570a4d492b78816165ff97d0358ff73","comparison":{"attack_flag_delta":null,"benign_burden_ceiling":{"denominator":20,"numerator":1,"rate":0.05},"candidate":{"adversarial_flag":{"denominator":1,"numerator":0,"rate":0.0},"benign_intervention":{"denominator":1,"numerator":1,"rate":1.0},"burden_compliant":false,"system":{"config_digest":"sha256:817bc01e97437c2d5a38971c5164dae28570a4d492b78816165ff97d0358ff73","implementation_digest":"sha256:5b26967ffcabd4f7d3f5577124b46882cdb0d21d364e5e3b10e279cafa17764b","name":"aragorn","version":"0.1.0-phase0"}},"comparators":[{"adversarial_flag":{"denominator":1,"numerator":0,"rate":0.0},"benign_intervention":{"denominator":1,"numerator":1,"rate":1.0},"burden_compliant":false,"system":{"config_digest":"sha256:0471e144da9f709a1596d0daa15c6faf85c6358d12840dadb652a1e45369085a","implementation_digest":"sha256:7fadcfbe836eef9490feba0fadd2ada564c11eb541077e3efee5f61edbd2e65c","name":"cisco-skill-scanner","version":"2.0.12"}},{"adversarial_flag":{"denominator":1,"numerator":1,"rate":1.0},"benign_intervention":{"denominator":1,"numerator":1,"rate":1.0},"burden_compliant":false,"system":{"config_digest":"sha256:2de741d4af73b3047ec0307795f7ceeb0f39e25837a5a8a7c97fa23992de7207","implementation_digest":"sha256:e731be01105243f94437a4b9bd449bd46bbcb5cb306f44b4845121d109a4a95e","name":"skillspector","version":"2.4.3+git.a54947c"}}],"evaluable":false,"minimum_attack_flag_delta":{"denominator":10,"numerator":1,"rate":0.1},"pareto_frontier":[{"adversarial_flag":{"denominator":1,"numerator":1,"rate":1.0},"benign_intervention":{"denominator":1,"numerator":1,"rate":1.0},"burden_compliant":false,"system":{"config_digest":"sha256:2de741d4af73b3047ec0307795f7ceeb0f39e25837a5a8a7c97fa23992de7207","implementation_digest":"sha256:e731be01105243f94437a4b9bd449bd46bbcb5cb306f44b4845121d109a4a95e","name":"skillspector","version":"2.4.3+git.a54947c"}}],"passed":false,"reason_codes":["CANDIDATE_BURDEN_CEILING_EXCEEDED","NO_BURDEN_COMPLIANT_COMPARATOR"],"selected_comparator":null},"corpus_lock_digest":"sha256:2390161f836ac42a5b8526d5ec0b11a2dce9a3c693e3d76513f7b4959eb533b9","evaluation_split":"hidden","hidden_suite_lock_digest":"sha256:68ed78218e3efe41b2cdef1c0873472b52093a42b4001f9b6a60d860476b9def","label_ledger_digest":"sha256:190b22d0d77bd7709497a4242bf0af61506a682086f0b623f59abbc2d0b4c5c0","outcomes_digest":"sha256:69cee5d65d74c0c5fda86baff1e5b2eb5a6093d8cee5a3c4ec0a13c9f6b34b97","public_manifest_digest":"sha256:8f74ebbbf4a146992ec7088282d93e94ce11e0ca3845a74522fa745d9974c808","purpose":"evidence_smoke","schema":"aragorn/benchmark-phase0-gate-report/v2","suite_digest":"sha256:75bb5723bbc4973f94f5bea7d54eee76025da57cce806e0aef11740ec83305af","suite_id":"phase0-hidden-independent-v3.0.0"},"phase0_exit_eligible":false,"recorded_on":"2026-07-26","schema":"aragorn/benchmark-phase0-hidden-result-receipt/v1","source":{"evaluator_commit":"089b5ae9f9c320da04e70d71096979916205ab20","gate_report_file_digest":"sha256:07b81d12af883af94da06010bad60dbdfee3fbbd8569ad2f2c48947824d153ca","worker_run_receipt_digest":"sha256:69fa7920b6e226de0871f404f16412ad728d90db5b26710efbff246ba1d72d6c"},"worker_run_receipt":{"assurance":"authenticated_complete_worker_batch_not_independent_or_hardware_attested","batch":{"acceptance_set_digest":"sha256:29fe527096caaa532846d23881e22ec54426c0f895aa117c6a77e0a18803b930","accepted_count":896,"result_set_digest":"sha256:f6862790d480c94b16cf44292384ba869aa1235dbf8454afacbc77c59c3a025c"},"composition":{"composition_digest":"sha256:bf08c6293d8217f4b0f5aafca6c00affeed297b656f1824b63e024874d120213","outcome_count":1344,"outcomes_digest":"sha256:69cee5d65d74c0c5fda86baff1e5b2eb5a6093d8cee5a3c4ec0a13c9f6b34b97","outcomes_file_digest":"sha256:485fce6807c4231acd2aaf2ef328e578ef45802284dfad18fcade4e33408c264"},"limitations":{"authorship":"technical_codex_authorship_not_independent_human_identity","custody":"software_signatures_operator_uid_trusted_not_same_uid_or_hardware_attested","worker_attestation":"software_key_possession_not_vm_or_hardware_attestation"},"schema":"aragorn/benchmark-phase0-hidden-worker-run-receipt/v3","source":{"preparation_receipt_digest":"sha256:ff2d0de6ac65fbdf5da733cd70737168f362dd72fa7648c4f6af6a0c999e8d7f","runner_commit":"089b5ae9f9c320da04e70d71096979916205ab20"},"state":{"binding_digest":"sha256:e29cd500844122f1c9c4213f1653ca2928bcc49fa1cb2f7ed06005d240ae75ba","layout":"phase0-hidden-run-state/v1"}}}